{
  "meta": {
    "name": "O Átrio",
    "seed": "atrio-teste",
    "tickCount": 2,
    "worldTime": 120
  },
  "width": 32,
  "height": 32,
  "tiles": [
    {"biome":"meadow"},
    {"biome":"meadow"},
    {"biome":"meadow"},
    {"biome":"meadow"},
    {"biome":"meadow"},
    {"biome":"meadow"},
    {"biome":"meadow"},
    {"biome":"meadow"},
    {"biome":"meadow"},
    {"biome":"meadow"},
    {"biome":"meadow"},
    {"biome":"meadow"},
    {"biome":"meadow"},
    {"biome":"meadow"},
    {"biome":"meadow"},
    {"biome":"meadow"},
    {"biome":"meadow"},
    {"biome":"meadow"},
    {"biome":"meadow"},
    {"biome":"meadow"},
    {"biome":"meadow"},
    {"biome":"meadow"},
    {"biome":"meadow"},
    {"biome":"meadow"},
    {"biome":"meadow"},
    {"biome":"meadow"},
    {"biome":"meadow"},
    {"biome":"meadow"},
    {"biome":"forest","resource":"wood"},
    {"biome":"forest"},
    {"biome":"forest"},
    {"biome":"forest"},
    {"biome":"meadow"},
    {"biome":"meadow"},
    {"biome":"meadow"},
    {"biome":"meadow"},
    {"biome":"meadow"},
    {"biome":"meadow"},
    {"biome":"meadow"},
    {"biome":"ruins","resource":"stone"},
    {"biome":"meadow"},
    {"biome":"meadow"},
    {"biome":"meadow"},
    {"biome":"meadow"},
    {"biome":"meadow"},
    {"biome":"meadow"},
    {"biome":"meadow"},
    {"biome":"meadow"},
    {"biome":"meadow"},
    {"biome":"meadow"},
    {"biome":"meadow"},
    {"biome":"meadow","resource":"pulse_fragment"},
    {"biome":"meadow"},
    {"biome":"meadow"},
    {"biome":"meadow"},
    {"biome":"meadow"},
    {"biome":"meadow"},
    {"biome":"meadow"},
    {"biome":"meadow"},
    {"biome":"forest"},
    {"biome":"forest"},
    {"biome":"forest"},
    {"biome":"meadow"},
    {"biome":"meadow"},
    {"biome":"meadow"},
    {"biome":"meadow"},
    {"biome":"meadow"},
    {"biome":"meadow"},
    {"biome":"meadow"},
    {"biome":"ruins"},
    {"biome":"ruins","resource":"stone"},
    {"biome":"ruins","resource":"stone"},
    {"biome":"meadow"},
    {"biome":"meadow"},
    {"biome":"meadow"},
    {"biome":"meadow"},
    {"biome":"meadow"},
    {"biome":"meadow"},
    {"biome":"meadow"},
    {"biome":"meadow"},
    {"biome":"meadow"},
    {"biome":"meadow"},
    {"biome":"meadow"},
    {"biome":"water"},
    {"biome":"water"},
    {"biome":"meadow"},
    {"biome":"meadow"},
    {"biome":"meadow"},
    {"biome":"meadow"},
    {"biome":"meadow"},
    {"biome":"forest"},
    {"biome":"forest"},
    {"biome":"forest"},
    {"biome":"forest"},
    {"biome":"forest"},
    {"biome":"forest"},
    {"biome":"meadow"},
    {"biome":"meadow"},
    {"biome":"meadow"},
    {"biome":"meadow"},
    {"biome":"meadow"},
    {"biome":"ruins"},
    {"biome":"ruins","resource":"stone"},
    {"biome":"ruins","resource":"stone"},
    {"biome":"meadow"},
    {"biome":"meadow"},
    {"biome":"meadow"},
    {"biome":"meadow"},
    {"biome":"meadow"},
    {"biome":"meadow"},
    {"biome":"meadow"},
    {"biome":"meadow"},
    {"biome":"meadow"},
    {"biome":"meadow"},
    {"biome":"meadow"},
    {"biome":"water"},
    {"biome":"meadow"},
    {"biome":"meadow"},
    {"biome":"meadow"},
    {"biome":"meadow"},
    {"biome":"meadow"},
    {"biome":"meadow"},
    {"biome":"forest"},
    {"biome":"forest","resource":"wood"},
    {"biome":"forest"},
    {"biome":"forest"},
    {"biome":"forest"},
    {"biome":"meadow"},
    {"biome":"meadow"},
    {"biome":"meadow"},
    {"biome":"meadow"},
    {"biome":"meadow"},
    {"biome":"meadow"},
    {"biome":"ruins"},
    {"biome":"meadow"},
    {"biome":"ruins"},
    {"biome":"ruins"},
    {"biome":"meadow"},
    {"biome":"meadow"},
    {"biome":"meadow"},
    {"biome":"meadow"},
    {"biome":"meadow"},
    {"biome":"meadow"},
    {"biome":"meadow"},
    {"biome":"meadow"},
    {"biome":"meadow"},
    {"biome":"meadow"},
    {"biome":"water"},
    {"biome":"water"},
    {"biome":"meadow"},
    {"biome":"meadow"},
    {"biome":"meadow"},
    {"biome":"meadow"},
    {"biome":"meadow"},
    {"biome":"meadow"},
    {"biome":"forest","resource":"wood"},
    {"biome":"forest"},
    {"biome":"forest"},
    {"biome":"forest"},
    {"biome":"forest","resource":"wood"},
    {"biome":"meadow"},
    {"biome":"meadow"},
    {"biome":"meadow"},
    {"biome":"meadow"},
    {"biome":"meadow"},
    {"biome":"meadow"},
    {"biome":"meadow"},
    {"biome":"ruins","resource":"stone"},
    {"biome":"ruins","resource":"stone"},
    {"biome":"meadow"},
    {"biome":"meadow"},
    {"biome":"meadow"},
    {"biome":"meadow"},
    {"biome":"meadow"},
    {"biome":"meadow"},
    {"biome":"meadow"},
    {"biome":"meadow"},
    {"biome":"meadow"},
    {"biome":"meadow"},
    {"biome":"water"},
    {"biome":"water"},
    {"biome":"meadow"},
    {"biome":"meadow"},
    {"biome":"meadow"},
    {"biome":"meadow"},
    {"biome":"forest"},
    {"biome":"forest"},
    {"biome":"forest"},
    {"biome":"forest","resource":"wood"},
    {"biome":"meadow"},
    {"biome":"forest"},
    {"biome":"forest"},
    {"biome":"meadow"},
    {"biome":"meadow"},
    {"biome":"meadow"},
    {"biome":"meadow"},
    {"biome":"meadow"},
    {"biome":"meadow"},
    {"biome":"ruins","resource":"stone"},
    {"biome":"ruins","resource":"stone"},
    {"biome":"ruins","resource":"stone"},
    {"biome":"meadow"},
    {"biome":"meadow"},
    {"biome":"meadow"},
    {"biome":"meadow"},
    {"biome":"meadow"},
    {"biome":"meadow"},
    {"biome":"meadow"},
    {"biome":"meadow"},
    {"biome":"water"},
    {"biome":"water"},
    {"biome":"water"},
    {"biome":"water"},
    {"biome":"water"},
    {"biome":"water"},
    {"biome":"water"},
    {"biome":"meadow"},
    {"biome":"forest"},
    {"biome":"forest"},
    {"biome":"forest","resource":"wood"},
    {"biome":"forest"},
    {"biome":"meadow"},
    {"biome":"forest","resource":"wood"},
    {"biome":"forest"},
    {"biome":"meadow"},
    {"biome":"meadow"},
    {"biome":"meadow"},
    {"biome":"meadow"},
    {"biome":"meadow"},
    {"biome":"meadow"},
    {"biome":"ruins","resource":"stone"},
    {"biome":"meadow"},
    {"biome":"meadow"},
    {"biome":"meadow"},
    {"biome":"meadow"},
    {"biome":"meadow"},
    {"biome":"meadow"},
    {"biome":"meadow"},
    {"biome":"meadow"},
    {"biome":"meadow"},
    {"biome":"water"},
    {"biome":"water"},
    {"biome":"water"},
    {"biome":"water"},
    {"biome":"water"},
    {"biome":"water"},
    {"biome":"water"},
    {"biome":"water"},
    {"biome":"water"},
    {"biome":"water"},
    {"biome":"forest"},
    {"biome":"forest"},
    {"biome":"forest"},
    {"biome":"meadow"},
    {"biome":"meadow"},
    {"biome":"meadow"},
    {"biome":"meadow"},
    {"biome":"meadow"},
    {"biome":"meadow"},
    {"biome":"meadow"},
    {"biome":"meadow"},
    {"biome":"meadow"},
    {"biome":"meadow"},
    {"biome":"meadow"},
    {"biome":"meadow"},
    {"biome":"meadow"},
    {"biome":"meadow"},
    {"biome":"meadow"},
    {"biome":"meadow"},
    {"biome":"meadow"},
    {"biome":"meadow"},
    {"biome":"meadow"},
    {"biome":"water"},
    {"biome":"water"},
    {"biome":"water"},
    {"biome":"water"},
    {"biome":"water"},
    {"biome":"water"},
    {"biome":"water"},
    {"biome":"water"},
    {"biome":"water"},
    {"biome":"water"},
    {"biome":"water"},
    {"biome":"meadow"},
    {"biome":"forest"},
    {"biome":"meadow"},
    {"biome":"meadow"},
    {"biome":"meadow"},
    {"biome":"meadow"},
    {"biome":"meadow"},
    {"biome":"meadow"},
    {"biome":"meadow"},
    {"biome":"meadow"},
    {"biome":"meadow"},
    {"biome":"meadow"},
    {"biome":"meadow"},
    {"biome":"meadow"},
    {"biome":"meadow"},
    {"biome":"meadow"},
    {"biome":"meadow"},
    {"biome":"meadow"},
    {"biome":"meadow"},
    {"biome":"meadow","resource":"pulse_fragment"},
    {"biome":"water"},
    {"biome":"water"},
    {"biome":"water"},
    {"biome":"water"},
    {"biome":"water"},
    {"biome":"water"},
    {"biome":"water"},
    {"biome":"water"},
    {"biome":"water"},
    {"biome":"water"},
    {"biome":"water"},
    {"biome":"water"},
    {"biome":"meadow"},
    {"biome":"forest","resource":"wood"},
    {"biome":"meadow"},
    {"biome":"meadow"},
    {"biome":"meadow"},
    {"biome":"meadow"},
    {"biome":"meadow"},
    {"biome":"meadow"},
    {"biome":"meadow"},
    {"biome":"meadow"},
    {"biome":"meadow"},
    {"biome":"meadow"},
    {"biome":"meadow"},
    {"biome":"meadow"},
    {"biome":"meadow"},
    {"biome":"meadow"},
    {"biome":"meadow"},
    {"biome":"meadow"},
    {"biome":"meadow"},
    {"biome":"meadow","resource":"pulse_fragment"},
    {"biome":"water"},
    {"biome":"water"},
    {"biome":"water"},
    {"biome":"water"},
    {"biome":"water"},
    {"biome":"water"},
    {"biome":"water"},
    {"biome":"water"},
    {"biome":"water"},
    {"biome":"water"},
    {"biome":"water"},
    {"biome":"water"},
    {"biome":"water"},
    {"biome":"meadow"},
    {"biome":"meadow"},
    {"biome":"meadow"},
    {"biome":"meadow"},
    {"biome":"meadow"},
    {"biome":"meadow"},
    {"biome":"meadow"},
    {"biome":"meadow"},
    {"biome":"meadow"},
    {"biome":"meadow"},
    {"biome":"meadow"},
    {"biome":"meadow"},
    {"biome":"meadow"},
    {"biome":"meadow"},
    {"biome":"meadow"},
    {"biome":"meadow"},
    {"biome":"meadow"},
    {"biome":"meadow"},
    {"biome":"meadow"},
    {"biome":"water"},
    {"biome":"water"},
    {"biome":"water"},
    {"biome":"water"},
    {"biome":"water"},
    {"biome":"water"},
    {"biome":"water"},
    {"biome":"water"},
    {"biome":"water"},
    {"biome":"water"},
    {"biome":"water"},
    {"biome":"water"},
    {"biome":"meadow"},
    {"biome":"meadow"},
    {"biome":"meadow"},
    {"biome":"meadow"},
    {"biome":"meadow"},
    {"biome":"meadow"},
    {"biome":"meadow"},
    {"biome":"meadow"},
    {"biome":"meadow"},
    {"biome":"meadow"},
    {"biome":"meadow"},
    {"biome":"meadow"},
    {"biome":"meadow"},
    {"biome":"meadow"},
    {"biome":"meadow"},
    {"biome":"meadow"},